<?xml version="1.0" encoding="UTF-8"?>
<libros 
xmlns="http://www.uniovi.es"
xmlns:xsi="http://www.w3.org/2001/XMLSchema-instance"
xsi:schemaLocation="http://www.uniovi.es libros.xsd"
>
<libro isbn="ISBN-9788420633114">
<titulo>El Aleph</titulo>
<autor>Jorge Luis Borges</autor>
<año>1946</año>
<precio moneda="Euro">7.80</precio>
<editorial>Alianza Editorial</editorial>
<clasificacion>Literatura</clasificacion>
<idioma>Español</idioma>
</libro>
<libro isbn="ISBN-9780470036662">
<titulo>Domain-Specific Modeling. Enabling full code generation</titulo>
<autor>Steven Kelly</autor>
<autor>Juha-Pekka Tolvanen</autor>
<año>2008</año>
<precio moneda="Dolar USA">74.03</precio>
<editorial>Wiley</editorial>
<clasificacion>Informática</clasificacion>
<idioma>Inglés</idioma>
</libro>
</libros>